[
  {
    "name": "Bitterling",
    "shadowSize": "1",
    "location": "River",
    "time": "All day",
    "price": 900,
    "month": {
      "north": [1, 2, 3, 11, 12],
      "south": [5, 6, 7, 8, 9]
    }
  },
  {
    "name": "Pale Chub",
    "shadowSize": "1",
    "location": "River",
    "time": "9 AM - 4 PM",
    "price": 200,
    "month": {
      "north": [1, 2, 3, 4, 5, 6, 7, 8, 9, 10, 11, 12],
      "south": [1, 2, 3, 4, 5, 6, 7, 8, 9, 10, 11, 12]
    }
  },
  {
    "name": "Crucian Carp",
    "shadowSize": "2",
    "location": "River",
    "time": "All day",
    "price": 160,
    "month": {
      "north": [1, 2, 3, 4, 5, 6, 7, 8, 9, 10, 11, 12],
      "south": [1, 2, 3, 4, 5, 6, 7, 8, 9, 10, 11, 12]
    }
  },
  {
    "name": "Dace",
    "shadowSize": "3",
    "location": "River",
    "time": "4 PM - 9 AM",
    "price": 240,
    "month": {
      "north": [1, 2, 3, 4, 5, 6, 7, 8, 9, 10, 11, 12],
      "south": [1, 2, 3, 4, 5, 6, 7, 8, 9, 10, 11, 12]
    }
  },
  {
    "name": "Carp",
    "shadowSize": "4",
    "location": "Pond",
    "time": "All day",
    "price": 300,
    "month": {
      "north": [1, 2, 3, 4, 5, 6, 7, 8, 9, 10, 11, 12],
      "south": [1, 2, 3, 4, 5, 6, 7, 8, 9, 10, 11, 12]
    }
  },
  {
    "name": "Koi",
    "shadowSize": "4",
    "location": "Pond",
    "time": "4 PM - 9 AM",
    "price": 4000,
    "month": {
      "north": [1, 2, 3, 4, 5, 6, 7, 8, 9, 10, 11, 12],
      "south": [1, 2, 3, 4, 5, 6, 7, 8, 9, 10, 11, 12]
    }
  },
  {
    "name": "Goldfish",
    "shadowSize": "1",
    "location": "Pond",
    "time": "All day",
    "price": 1300,
    "month": {
      "north": [1, 2, 3, 4, 5, 6, 7, 8, 9, 10, 11, 12],
      "south": [1, 2, 3, 4, 5, 6, 7, 8, 9, 10, 11, 12]
    }
  },
  {
    "name": "Pop-eyed goldfish",
    "shadowSize": "1",
    "location": "Pond",
    "time": "9 AM - 4 PM",
    "price": 1300,
    "month": {
      "north": [1, 2, 3, 4, 5, 6, 7, 8, 9, 10, 11, 12],
      "south": [1, 2, 3, 4, 5, 6, 7, 8, 9, 10, 11, 12]
    }
  },
  {
    "name": "Ranchu goldfish",
    "shadowSize": "2",
    "location": "Pond",
    "time": "9 AM - 4 PM",
    "price": 4500,
    "month": {
      "north": [1, 2, 3, 4, 5, 6, 7, 8, 9, 10, 11, 12],
      "south": [1, 2, 3, 4, 5, 6, 7, 8, 9, 10, 11, 12]
    }
  },
  {
    "name": "Killifish",
    "shadowSize": "1",
    "location": "Pond",
    "time": "All day",
    "price": 300,
    "month": {
      "north": [4, 5, 6, 7, 8],
      "south": [1, 2, 10, 11, 12]
    }
  },
  {
    "name": "Crawfish",
    "shadowSize": "2",
    "location": "Pond",
    "time": "All day",
    "price": 200,
    "month": {
      "north": [4, 5, 6, 7, 8, 9],
      "south": [1, 2, 3, 10, 11, 12]
    }
  },
  {
    "name": "Soft-shelled Turtle",
    "shadowSize": "4",
    "location": "River",
    "time": "4 PM - 9 AM",
    "price": 3750,
    "month": {
      "north": [8, 9],
      "south": [2, 3]
    }
  },
  {
    "name": "Snapping turtle",
    "shadowSize": "5",
    "location": "River",
    "time": "9 PM - 4 AM",
    "price": 5000,
    "month": {
      "north": [4, 5, 6, 7, 8, 9, 10],
      "south": [1, 2, 3, 4, 10, 11, 12]
    }
  },
  {
    "name": "Tadpole",
    "shadowSize": "1",
    "location": "Pond",
    "time": "All day",
    "price": 100,
    "month": {
      "north": [3, 4, 5, 6, 7],
      "south": [1, 9, 10, 11, 12]
    }
  },
  {
    "name": "Frog",
    "shadowSize": "2",
    "location": "Pond",
    "time": "All day",
    "price": 120,
    "month": {
      "north": [5, 6, 7, 8],
      "south": [1, 2, 11, 12]
    }
  },
  {
    "name": "Freshwater Goby",
    "shadowSize": "2",
    "location": "River",
    "time": "4 PM - 9 AM",
    "price": 400,
    "month": {
      "north": [1, 2, 3, 4, 5, 6, 7, 8, 9, 10, 11, 12],
      "south": [1, 2, 3, 4, 5, 6, 7, 8, 9, 10, 11, 12]
    }
  },
  {
    "name": "Loach",
    "shadowSize": "2",
    "location": "River",
    "time": "All day",
    "price": 400,
    "month": {
      "north": [3, 4, 5],
      "south": [9, 10, 11]
    }
  },
  {
    "name": "Catfish",
    "shadowSize": "4",
    "location": "Pond",
    "time": "4 PM - 9 AM",
    "price": 800,
    "month": {
      "north": [5, 6, 7, 8, 9, 10],
      "south": [1, 2, 3, 4, 11, 12]
    }
  },
  {
    "name": "",
    "shadowSize": "",
    "location": "",
    "time": "",
    "price": 0,
    "month": {
      "north": [1, 2, 3, 4, 5, 6, 7, 8, 9, 10, 11, 12],
      "south": [1, 2, 3, 4, 5, 6, 7, 8, 9, 10, 11, 12]
    }
  }
]
